{
  "schema_version": 1, "minimum_reader_version": "0.4.0", "snapshot_id": "snapshot-1", "project_id": "project-p", "provider": "codex", "session_id": "session-1", "usage_record_digest": "sha256:1111111111111111111111111111111111111111111111111111111111111111", "billing_host": "api.example.test", "billed_model_id": "model-1", "billing_mode": "standard", "billing_rule_version": "rules-v1", "region": null, "priced_at": "2026-09-04T00:00:00Z", "created_at": "2026-09-04T00:00:00Z", "status": "current", "modelpricewatch_listing_id": null, "source_kind": "official", "source_url": "https://example.test/pricing", "detail_url": null, "source_last_updated": null, "retrieved_at": null, "promo": false, "promo_until": null,
  "rates": { "input": 1.0, "cached_input": 0, "cache_write_input": null, "output": 2.0, "reasoning_output": null }, "billable_quantities": { "input": 10, "cached_input": 0, "cache_write_input": 0, "output": 5, "reasoning_output": 0 }, "line_costs_usd": { "input": 0.00001, "cached_input": 0, "cache_write_input": null, "output": 0.00001, "reasoning_output": null }, "missing_billing_dimensions": [], "known_subtotal_usd": 0.00002, "total_cost_usd": null, "pricing_complete": false, "supersedes_snapshot_id": null, "audit_reason": "Official price matched exact billing route."
}
